{
  "name": "The Hedge Witch",
  "category": "Personality",
  "power_tags": [
    "knows which roots bite back",
    "welcome at every hearth",
    "reads the omens in a dead bird",
    "steady hands in a bad birth"
  ],
  "weakness_tags": ["the village fears me", "cannot leave a debt unpaid"],
  "quest": "Heal someone the village has already given up on, and be thanked for it.",
  "improvements": [
    {
      "name": "Second Sight",
      "effect": "Add a power tag describing what the spirits let you see that others cannot."
    },
    {
      "name": "Herbs for every ailment",
      "effect": "Once per session, treat a failure to mend or soothe as a partial success."
    },
    { "name": "Known by name" }
  ],
  "meta": {
    "publication_type": "homebrew",
    "authors": ["schema-in-the-mist contributors"]
  }
}
